QUERY,DOC_ID
Guanine nucleotide dissociation inhibitor (Rho-GDI) interacts with the p75 NTR death domain,2422
Guanine nucleotide exchange factors (GEFs) mediate RhoA activation in response to tensional forces on fibronectin-binding integrins.,1860
H.pylori-mediated gastric cancer occurs due to the accumulation of mutations in host epithelial cells.,3354
H4 G94P proteins induce chromatin assembly  which increases free histones.,2410
H4 G94P proteins induce degradation of free histones via Rad53-dependent mechanisms.,2410
H4 G94P proteins inhibit chromatin assembly  which decreases free histones.,2410
H4 G94P proteins suppress degradation of free histones via Rad53-dependent mechanisms.,2410
HAND2 methylation is a key step in early endometrial carcinogenesis.,322
HIV trans-activator protein (TAT) effectively transports large and small molecules across cellular membranes into larger populations of neurons.,1223
HNF4A mutations are associated with macrosomia in infancy.,5054
HOXB4 facilitates HSC expansion when co-cultured with HSCs.,2954
HOXB4 is a highly expressed component of cellular secretome from fetal liver cell populations.,2954
HSCT-T dosage may not be diagnostic if the onset of symptoms occurs less than 3 hours before AMI.,4423
Having a main partner improves HIV outcomes.,2694
Having a main partner worsens HIV outcomes.,2694
HbA1c consistently overestimates glycemic control in black individuals with Sickle cell trait (SCT).,3864
Headaches are correlated with cognitive impairment.,2784
Healthy volunteers exhibit rapid and transient increase of cellular ATP after being bolus-injected with fructose.,1849
Helicobacter pylori-induced aberrant NF-kB-dependent expression of activation-induced cytidine deaminase contributes to the mutagenesis of host DNA.,3354
Helminths interfere with immune system control of coinfections by microbial pathogens 16.,1345
Hematopoietic Stem Cell purification reaches purity rates above 90%.,2312
High levels of CRP lead to a higher risk of exacerbations in chronic obstructive pulmonary disease (COPD).,4130
Higher plasma levels of I-carnitine  when associated with trimethylamine N-oxide  are negatively correlated with cardiovascular events in humans.,2435
Higher plasma levels of I-carnitine  when associated with trimethylamine N-oxide  are positively correlated with cardiovascular events in humans.,2435
Homozygous deletion of murine Sbds gene from osterix-expressing mesenchymal stem and progenitor cells (MPCs) induces oxidative stress.,693
Human embryonic stem cells give rise to cell types from all three embryonic germ layers.,1798
Human embryonic stem cells give rise to cell types from the outer embryonic germ layer  but not the other two layers.,1798
Human embryonic stem cells have the capacity to give rise to differentiated progeny representative of all three embryonic germ layers.,1798
Hypocretin neurones suppress panicprone state in rats.,2583
Hypothalamic glutamate neurotransmission is unrelated to energy balance.,4946
IFI16 impedes STING phosphorylation and translocation  resulting in reduced activation of STING.,2964
IFIT1 speeds viral replication by allowing for the proliferation of mis-capped viral RNAs.,3559
IL-10 production by monocytes inhibits CD4 + T cell response.,1818
IL-6 signaling plays a major role in atherosclerotic cardiovascular disease.,2816
ITAM phosphorylation allows for the transfer of the T cell receptor (TCR) signal from the echo-domain to the cytoplasmic tail of the T cell receptor (TCR).,4336
IgA plasma cells that are specific for transglutaminase 2 are scarce in the duodenal mucosa of celiac disease patients when the disease is active.,267
Immune complex triggered cell death leads to extracellular release of nuclear DNA.,189
Immune complex triggered cell death leads to sequestration of oxidized mitochondrial DNA.,189
Immune responses in immune cells are geographically segregated.,617
Improvements in OER catalysts show stable activity over several hundred hours.,3006
In British Men  haplogroup I decreases risk of cardiovascular disease.,530
In British Men  haplogroup I increases risk of cardiovascular disease by 50%.,530
In S. cerevisiae  the absence of RNA surveillance pathways causes sensitivity to high iron conditions.,2592
In S. cerevisiae  the absence of RNA surveillance pathways reduces sensitivity to high iron conditions.,2592
In a naive state  blocking Wingless-Int-1 secretion from mouse embryonic stem cells inhibits self-renewal of the mouse embryonic stem cells.,3449
In breast cancer  the loss of myoepithelial cells promotes the transition of ductal carcinoma in situ to invasive carcinoma.,3036
In breast cancer  the loss of myoepithelial cells slows the transition of ductal carcinoma in situ to invasive carcinoma.,3036
In chronic viral infections or tumors  peptides that selectively inhibit PTPRS can be utilized to boost insufficient activity of pDCs.,854
In domesticated populations of Saccharomyces cerevisiae  segmental aneuploidy is very common.,1766
In domesticated populations of Saccharomyces cerevisiae  segmental aneuploidy occurs infrequently.,1766
In melanoma  anti-CTLA-4 treatment reinvigorates exhausted PD-1+Eomes+CD8 T cells.,879
In patients with congenital heart defects  β-blockers significantly improve clinical heart failure outcomes.,4383
In pediatric tissue  most T cells are naive T cell emigrants from the thymus.,3455
In rhesus macaques  daily subcutaneous injections of emtricitabine are ineffective at protecting against rectally transmitted simian-human immunodeficiency virus.,2351
In rhesus macaques  daily subcutaneous injections of tenofovir protects against rectally transmitted simian-human immunodeficiency virus.,2351
In the UK  drowning affects boys and girls equally.,4840
In transgenic mice harboring green florescent protein under the control of the Sox2 promoter  more than 50 percent of the cells with green florescent colocalize with cell proliferation markers.,2686
In young and middle-aged adults  current or remote uses of ADHD medications increase the risk of serious cardiovascular events.,1859
Incidence of 10/66 dementia is higher than the incidence of DSM-IV dementia.,2419
Incidence of 10/66 dementia is lower than the incidence of DSM-IV dementia.,2419
Incidence of heart failure increased by 10% in women since 1979.,2961
Incidence of sepsis has fallen substantially from 2009 to 2014.,927
Including pharmacists in rounding teams does not alter the incidence of adverse drug events (ADEs).,2031
Including pharmacists in rounding teams reduces the incidence of adverse drug events (ADEs).,2031
Increase of p62 in prostate tumor stroma results in defective autophagy.,657
Increased LDL receptors plays a role in the reduction of plasma Lp(a).,1211
Increased conversion of PGE 2 to PPARy ligand 15-ket-PGE 2 causes accumulation of PGE.,133
Increased diastolic blood pressure (DBP) is associated with abdominal aortic aneurysm.,887
Increased flux of microbial products provokes immune responses.,4716
Increased flux of microbial products suppresses immune responses.,4716
Increased lipolysis leads to higher P38 phosphorylation in adipose tissue.,4276
Increased microtubule acetylation exacerbates LRRK2 Roc-COR domain mutation induced locomotor deficits.,1676
Increased microtubule acetylation repairs interference of axonal transport caused by LRRK2 Roc-COR domain mutations.,1676
Increased microtubule acetylation worsens interference of axonal transport caused by LRRK2 Roc-COR domain mutations.,1676
Increased mobility of retrotransposons does not lead to mutation and higher tumorigenesis rates.,3
Increased mobility of retrotransposons is assosciated with mutation and higher tumorigenesis rates.,3
Increased purity of cytoplasmic membranes isolated from overexpressors is indicated by stronger spots for OmpF in 2D BN-PAGE gels.,1256
Increased vessel density along with a reduction in fibrosis improves the efficacy of chemotherapy treatments.,472
Individuals with Alzheimers who participate in six months of physical activity improve cognitive function for up to 18 months.,299
Individuals with low serum vitamin D concentrations have decreased risk of multiple sclerosis.,2687
Induced hepatic stem cells possess the potential to differentiate into cholangiocytic cells.,3000
Induced hepatic stem cells possess the potential to differentiate into hepatocytic cells.,3000
Induction of urokinase receptor signaling in podocytes causes foot process effacement and proteinuria.,2615
Inhibiting HDAC6 increases survival of mice with ARID1A mutated tumors.,1025
Inhibiting focal adhesion formation enables cells to convert mechanical strain into eventual scarring.,979
Inhibiting focal adhesion formation increases the rate at which cells convert mechanical strain into inflammation and fibrosis.,979
Inhibiting glucose-6-phospate dehydrogenase improves lipogenesis by deactivating LKB1-AMPK signaling.,306
Input from  mental and physical health care professionals is not effective at decreasing homelessness.,3786
Inside the body  falciparum parasites reproduce asexually.,1202
Insulin decreases risk of severe kidney failure.,2220
Insulin effects appetite via ventral tegmental neurons.,2511
Intake of folic acid (FA) and vitamin B6 (VB6) increases levels of homocysteine.,2100
Intake of folic acid (FA) and vitamin B6 (VB6) reduces levels of homocysteine.,2100
Integrated care is ineffective at tackling multiple comorbidities.,2463
Integrated care is successful at tackling multiple comorbidities.,2463
Integrating classroom-based collaborative learning with Web-based collaborative learning offers the best class performance.,2094
Interferon stimulated genes (ISGs) Irf1  Irg1  Ifi27  and Rsad2 encourage West Nile virus replication in cortical neurons.,1641
Interferon stimulated genes (ISGs) Irf1  Irg1  Ifi27  and Rsad2 inhibit West Nile virus replication in cortical neurons.,1641
Interleukin-18 plays an important role in the pathogenesis of atherosclerosis.,3587
Intra-cerebroventricular infusion of amyloid-β oligomers increases expression of fibronectin type-III domain-containing protein 5 mRNA in mice hippocampi.,5056
Intra-cerebroventricular infusion of amyloid-β oligomers reduces expression of fibronectin type-III domain-containing protein 5 mRNA in mice hippocampi.,5056
Intramembrane cleavage by signal peptide peptidase aids in the degradation of proteins with a complex membrane orientation.,1517
It is not proven that moderate consumption of candy and chocolate reduces the risk of cardiovascular disease (CVD) specifically.,1000
JMJD6 catalyzes the hydroxylation of C-terminal lysine and supresses transcriptional activity.,4547
JMJD6 slows the hydroxylation of C-terminal lysine,4547
KLF4 is necessary for VSMCs to gain genetic characteristics of other cell types within atherosclerotic lesions.,3276
KRT17 modulates the expression of the transcriptional regulator AIRE in diseased epithelia.,2064
Kir7.1 modulates channel activity by the G protein-coupled melanocortin-4 receptor (MC4R) in the paraventricular nucleus of the hypothalamus.,880
Klf2 is important for proper myeloid cell function.,1200
Klf4 is important for proper myeloid cell differentiation.,1200
Klf4 is not required for proper myeloid cell differentiation.,1200
Knockout proximal tubule-specific deletion of the BMP receptor Alk3 causes epithelial damage.,1046
Knockout proximal tubule-specific deletion of the BMP receptor Alk3 causes fibrosis.,1046
L3MBTL2 binds to H2AK119Ub marked chromatin to form a PRC1 complex.,2528
LDL cholesterol has a causal role in the development of cardiovascular disease.,389
LRBA prevents CTLA - 4 recycling.,158
LRBA promotes CTLA - 4 recycling.,158
LSD1-positive promoters are associated with RNA polymerase II,2225
Lack of FGF21 in mice increases life expectancy.,1633
Lack of FGF21 in mice leads to atherosclerotic plaque formation.,1633
Lack of FGF21 in mice leads to reduced lifespan.,1633
Lack of FGF21 in mice slows the rate of atherosclerotic plaque formation.,1633
Lamins are associated with nuclear membrane structure maintenance.,858
Lamins are found within the inner layer of the mitochondrial membrane of all cells.,858
Lamins are found within the inner layer of the nuclear membrane of all cells.,858
Lamins have no effect on nuclear membrane structure maintenance.,858
Less than 10% of patients exposed to radiation have activated markers of mesenchymal stem cells.,3276
Lice attenuated SIV vaccines induce a stronger antigen-specific T cell response in lymph node cells.,194
Lipopolysaccharides have an inflammation independent effect on kidney barrier function.,2615
Lmna knock-in models are appropriate for testing therapeutic approaches against Hutchinson-Gilford progeria syndrome (HGPS).,3338
Localization of PIN1 in the roots of Arabidopsis requires VPS9a,769
Long - range chromatin interactions regulate transcription.,2415
Long chain polyunsaturated fatty acids supplementation has no significant effects on wheezing or asthma at 3 and 6 years.,3317
Long chain polyunsaturated fatty acids supplementation is associated with lower rates of atopic eczema at 1 year.,3317
Long chain polyunsaturated fatty acids supplementation reduces wheezing and asthma.,3317
Low expression of miR7a does not repress target genes or exert a biological function in ovaries.,2843
Low expression of miR7a does not repress target genes or exert a biological function in testis.,2843
Low nucleosome occupancy correlates with high methylation levels across species.,2746
Ly49Q directs the organization of neutrophil polarization by regulating membrane raft functions.,1037
Ly6C hi monocytes have a higher inflammatory capacity than Ly6C lo monocytes.,1364
Lysine histone demethylase inhibitor JIB 04 is inactive against KDM5A.,2186
M. stadtmanae does not induce ASC speck formation in BlaER1 monocytes.,4403
M. stadtmanae induces ASC speck formation in BlaER1 monocytes.,4403
MEK inhibitors are effective treatments in RAS-driven mouse models of cancer.,953
MFGE8 regulates fat absorption by binding to av-Beta3 and av-Beta5 integrins.,1011
MICAL redox enzymes regulate actin dynamics in many cell types.,2639
MICAL redox enzymes regulate actin dynamics.,2639
MT binding domain drives amyloid structure formation.,853
MUC1-C activates the NF-κB p65 signaling pathway by interacting with IκB kinase ß.,3400
MafA phosphorylation decreases its ubiquitination.,1900
MafA phosphorylation enhances its ubiquitination.,1900
MafA ubiquitination decreases the recruitment of coavtivator P/CAF by MafA.,1900
MafA ubiquitination increases the recruitment of coavtivator P/CAF by MafA.,1900
Major antigen-induced signals from the T cell receptor and secondary signals from costimulatory receptors are required for T cell activation.,2263
Major vault protein (MVP) leads to more aggressive tumors by regulating the sorting of tumor suppressive miR-193a into extracellular vesicles (EVs).,2972
Major vault protein regulates sorting of tumor suppressive miR-193a into EVs.,2972
Malaria has a high vectorial capacity.,207
Many cytokines that are produced by cancer cells also contribute to carcinogenesis.,2775
Many transmembrane receptors transmit signals by long-range conformational changes in the association of alpha-helices across the plasma membrane.,2701
Marmosets have a brain region homologous to Broca's area.,2344
Mathematical models predict that using Artemisinin-based combination therapy over nongametocytocidal drugs have only a modest impact in reducing malaria transmission.,329
MeCP2 influences the synaptic maturation of neurons.,1731
Measuring routine outcomes is more beneficial to clinical practice than assessing treatment adherence.,912
Medications to treat obesity are highly effective.,1369
Medications to treat obesity do not have side effects.,1369
Medications to treat obesity have unwanted side effects.,1369
Men are more susceptible to death due to pneumonia when compared to women.,460
Metastatic colorectal cancer treated with a single agent fluoropyrimidines resulted in similar efficacy and better quality of life when compared with oxaliplatin-based chemotherapy in elderly patients.,2502
Mice are incapable of producing neutralizing antibodies in reponse to the Chikungunya virus (CHIKV) produced in mosquitos.,3673
Mice defective for deoxyribonucleic acid (DNA) polymerase I (polI) fail to reveal increased sensitivity to ionizing radiation (IR).,4268
Mice defective for deoxyribonucleic acid (DNA) polymerase m (polm) fail to reveal increased sensitivity to ionizing radiation (IR).,4268
Mice defective for deoxyribonucleic acid (DNA) polymerase m (polm) reveal increased sensitivity to ionizing radiation (IR).,4268
Mice lacking Sirt1 in Sf1-expressing neurons are immune to diet-induced obesity and insulin resistance.,2127
Mice lacking Sirt1 in Sf1-expressing neurons have increased susceptibility to diet-induced obesity and insulin resistance.,2127
Mice that lack Interferon-γ or its receptor are highly susceptible to experimental autoimmune myocarditis.,1469
Mice without IFN-γ or its receptor are highly susceptible to EAM induced with α-MyHC/CFA.,1469
Microcin J25 encourages nucleoside triphosphate (NTP) binding.,919
Microcin J25 inhibits nucleoside triphosphate (NTP) binding.,919
Microglia are an innate immune cell type of the central nervous system.,2508
Microglia are an innate immune cell type of the peripheral nervous system.,2508
Migraine with aura is associated with ischemic stroke.,2579
Misunderstandings between doctors and patients can lead to non-adherence.,639
Mitochondria play a major role in apoptosis.,1521
Mitochondria play a major role in energy production.,1521
Mitochondria play a trivial role in calcium homeostasis.,1521
Moderate consumption of candy and chocolate reduces the risk of cardiovascular disease (CVD).,1000
Monoclonal antibody targeting of N-cadherin encourages castration resistance.,3287
Monoclonal antibody targeting of N-cadherin encourages metastasis.,3287
Monoclonal antibody targeting of N-cadherin inhibits castration resistance.,3287
Monoclonal antibody targeting of N-cadherin inhibits growth.,3287
Most termination events in Okazaki fragments are dictated by initiation patterns.,4513
"Mouse models can be generated using ""artificial spermatids.""",2206
Mutant mice lacking SVCT2 have severely reduced ascorbic acid levels in both brain and adrenals.,2971
Mutations in G-Beta protein GNB1 are present in many cancers  resulting in loss of interaction with G-alpha subunits and concomitant activation of AKT pathway.,4330
Mutations in RIM1 decrease levels of IME1 RNA.,1458
Mutations in RIM1 raise levels of IME1 RNA.,1458
Myelin sheaths are lipid-rich cellular structures.,2772
Myelin sheaths play a role in action potential propagation.,2772
N348I mutations cause resistance to nevirapine.,2484
N348I mutations reduce resistance to nevirapine.,2484
NAC destabilizes NO to increase the effect of contrast agents on renal functions.,906
NAC inhibits the generation of angiotensin-converting enzyme.,906
NR5A2 does not play a role in development of endometrial tissues.,2564
NR5A2 is important in reverse cholesterol transport in humans.,2564
Natriuretic peptides increase susceptibility to diabetes.,2533
Natriuretic peptides protect against diabetes.,2533
Neutrophil extracellular trap (NET) antigens may contain the targeted autoantigens PR3 and MPO.,2766
Neutrophils produce IL-1β in response to large particles.,3353
Nigerian physicians constitue the largest component of sub-Saharan Africa-trained physicians in the United States.,2394
Nonhuman primates are incapable of producing neutralizing antibodies in reponse to the Eilat virus (EILV) produced in mosquitos.,3673
Nonhypertensive people who are 55 years old have a 90% chance of developing hypertension during their lifetime.,2021
Noninvasive positive pressure ventilation is not predictive of acute respiratory failure after solid organ transplantation.,1462
Nonsteroidal antinflammatory drugs are ineffective as cancer treatments.,4885
Nonsteroidal antinflammatory drugs show potential anticancer indications.,4885
Normal expression of RUNX1 causes tumorsupressing effects.,365
Normal granulomas form in the absence of TNF in Zebrafish.,2586
Normal granulomas form in the presence of TNF in Zebrafish.,2586
Notch signaling occurs between tumor cells and stromal cells.,3069
Nuclear transfer from adult human fibroblasts to human oocytes can give rise to blastocysts containing expandable pluripotent cells.,4589
Oat tolerant coeliac patients may have oat specific inflammatory cells in their small bowel mucosa.,2365
Obesity decreases life quality.,5178
Obesity raises life quality.,5178
Occipital activation levels are associated with auditory spatial performance in parietal regions of the brain.,55
Omnivores produce less trimethylamine N-oxide from dietary I-carnitine than vegans.,2435
Omnivores produce more trimethylamine N-oxide from dietary I-carnitine than vegans.,2435
Omnivores produce more trimethylamine N-oxide from dietary I-carnitine than vegetarians.,2435
One in five surgical randomized controlled trials are discontinued early.,1195
One in two surgical randomized controlled trials are discontinued early.,1195
Origin gross domestic product(GDP) is negatively related to dengue virus (DENV-1) diffusion in air traffic shipments.,390
Origin gross domestic product(GDP) is positively related to dengue virus (DENV-1) diffusion in air traffic shipments.,390
Osteocytes have an essential role in G-CSF induced HSPC mobilization.,2205
Osteoparthritis (OA) is characterized by degeneration of articular cartilage  joint edge  and subchondral bone hyperplasia.,2427
Over half of the gabonese children with Schimmelpenning-Feuerstein-Mims syndrome (SFM) had a plasma lactate of more than 5mmol/L.,2874
Overexpressing Cnp1 N-tail variants exacerbates the temperature-sensitive growth defect of scm3-139.,2364
Overexpressing Cnp1 N-tail variants rescues the temperature-sensitive growth defect of scm3-139.,2364
Oxidative DNA damage activates STING signalling.,2146
Oxidative DNA damage inhibits STING signalling.,2146
Oxidative phosphorylation is one of the primary glycometabolic pathways in cells.,2867
PCSK9 inhibitors decrease plasma Lp(a) levels.,1211
PD-1 triggering on monocytes enhances IL-10 production by monocytes.,1818
PGE 2 suppresss intestinal tumor growth by altering the expression of tumor suppressing and DNA repair genes.,1268
PKG-la does not have a large impact on expression of pain hypersensitivity in PGK-la knockout mice.,1893
PKG-la does not have a large impact on expression of spinal long term potentiation in PGK-la knockout mice.,1893
PKG-la plays an essential role in expression of spinal long term potentiation in PGK-la knockout mice.,1893
PRC1-bound plasmids sediment at a slower rate in unbound plasmids than in sucrose gradients.,2797
PTEN is a regulator for the transcriptional activity of SRF,4377
Participants who quit smoking reduce lung cancer risk by approximately 50%.,2623
Patients in stable partnerships have a slower progression from HIV to AIDS.,2694
Patients in stable partnerships progress from HIV to death at the same rate as patients not in partnerships.,2694
Patients with common epithelial cancers  are more likely to have an emergency event as their first hospital admission if they live in resource-deprived areas.,2620
Patients with common epithelial cancers are less likely to have an emergency event as their first hospital admission if they live in resource-deprived areas.,2620
Patients with microcytosis and higher erythrocyte count are more vulnerable to severe malarial anaemia when infected with Plasmodium falciparum.,2813
Patients with microcytosis and higher erythrocyte count were more resistant to severe malarial anaemia when infected with Plasmodium falciparum.,2813
Patients with panic anxiety show decreased CSF levels of hypocretin.,2583
Pediatric SCD patients with vaso-occlusive crisis show increased morphine use after breathing 80 ppm iNO for 4 hours.,2423
Perigenital skin is not the primary site of HIV acquisition.,1522
Peroxynitrite is required for induction of T cell tolerance.,1028
Persister cells provide relapse resistance in cancer patients.,3889
Persistor cells are one reason for incomplete responses to Tyrosine kinase inhibitor (TKI) therapy in cancer patients.,3889
Pharmacist attendance at ward rounds increases adverse events in wards.,2031
Pharmacist attendance at ward rounds reduces adverse events in wards.,2031
Phase information is useful for predicting donor-recipient matches in organ transplantation.,1927
Physical activity does not improve cognitive function in individuals with Alzheimers.,299
Physical activity level has no association with the difference in maximal oxygen consumption between black and white youth.,1499
Physical activity level is associated with the difference in maximal oxygen consumption between black and white youth.,1499
Physical injury represses transgultaminase activity.,2212
Piezo1 channels are sensors for cell migration in epithelial cells.,3186
Pioglitazone use is not associated with an increased risk of prostate cancer.,597
Pioglitazone use is significantly associated with an increased risk of pancreatic cancer.,597
Pioglitazone use is significantly associated with an increased risk of prostate cancer.,597
Pioneer factor OCT3/4 interacts with major chromatin remodeling factors.,387
Polymeal nutrition increases cardiovascular mortality.,1562
Post-transcriptional handling of mitochondrial transcripts occurs in mitochondrial RNA granules.,2292
Pre-mRNAs associated with spliceosomal components are less stable than unassociated splicing substrates.,727
Pre-mRNAs associated with spliceosomal components are more stable than unassociated splicing substrates.,727
Prescribed exercise training improves quality of life.,4759
PrimPol degrades short DNA replication intermediates on the leading strand during DNA replication.,2926
